{
  "condition": {
    "color_keywords": [
      "blue"
    ],
    "effect_family": "explosion",
    "performance_tier": "standard",
    "prompt": "卡通蓝色爆炸冲击，短时爆发，清晰的命中冲击，不要长拖尾",
    "seed": 20260914,
    "style_family": "cartoon"
  },
  "created_at": "2026-09-03T13:33:48.879960+00:00",
  "graph_id": "pfg_e4d8b245fde06d7df064",
  "layers": [
    {
      "blocking_reasons": [],
      "candidates": [
        {
          "candidate_id": "material_candidate_284c19c0999b9c82",
          "material": {
            "binding_status": "usable",
            "material_id": "material_c7dcbe725ede6c9548ef",
            "path": "Assets/Hovl Studio/Sword slash VFX/Materials/Flare31bcg.mat"
          },
          "scores": {
            "color": 0,
            "diversity": 1.921552,
            "family": 24.0,
            "pairing": 32.0,
            "performance": 3.0,
            "pipeline": 4.0,
            "role": 30.0,
            "slot": 16.0,
            "style": 0,
            "total": 110.921552
          },
          "selection_basis": [
            "material, Shader and Texture are jointly ranked",
            "effect_family=explosion",
            "style_family=cartoon",
            "layer_role=core",
            "texture_property=_MainTex",
            "all selected assets are project_bindable",
            "prior Unity Material property binding is preferred when available"
          ],
          "shader": {
            "asset_id": "shader_3aacdc74b5eccdb04b80",
            "binding_status": "project_bindable",
            "name": "ERB/Particles/Blend_CenterGlow",
            "path": "Assets/Hovl Studio/Sword slash VFX/Shaders/Blend_CenterGlow.shader",
            "pipeline_tags": [
              "builtin"
            ]
          },
          "status": "pass",
          "texture": {
            "asset_id": "tex_f94e30197df4e14878f7",
            "binding_status": "project_bindable",
            "path": "Assets/Hovl Studio/Sword slash VFX/Textures/Flare31.png",
            "tags": [
              "alpha.cutout",
              "alpha.gradient",
              "alpha.sparse",
              "alpha.structured",
              "luma.bright_core",
              "luma.overbright_risk",
              "quality.license_unknown",
              "resolution.medium",
              "role.color_control",
              "role.core_shape",
              "role.edge_accent",
              "role.hit_accent",
              "role.noise_control",
              "semantic.slash",
              "semantic.spark",
              "shape.horizontal_strip",
              "size.512x128",
              "slot.alpha_mask",
              "slot.base_map",
              "slot.emission_map",
              "slot.ramp_map"
            ]
          },
          "texture_property_name": "_MainTex"
        },
        {
          "candidate_id": "material_candidate_c143e7f5b7140ba4",
          "material": {
            "binding_status": "usable",
            "material_id": "material_a47a05f1a9c151ca20a8",
            "path": "Assets/Hovl Studio/Sword slash VFX/Materials/Flash21cg.mat"
          },
          "scores": {
            "color": 0,
            "diversity": 1.874599,
            "family": 24.0,
            "pairing": 32.0,
            "performance": 3.0,
            "pipeline": 4.0,
            "role": 30.0,
            "slot": 16.0,
            "style": 0,
            "total": 110.874599
          },
          "selection_basis": [
            "material, Shader and Texture are jointly ranked",
            "effect_family=explosion",
            "style_family=cartoon",
            "layer_role=core",
            "texture_property=_MainTex",
            "all selected assets are project_bindable",
            "prior Unity Material property binding is preferred when available"
          ],
          "shader": {
            "asset_id": "shader_5ea0012bd0d5dabe96a0",
            "binding_status": "project_bindable",
            "name": "ERB/Particles/Add_CenterGlow",
            "path": "Assets/Hovl Studio/Sword slash VFX/Shaders/Add_CenterGlow.shader",
            "pipeline_tags": [
              "builtin"
            ]
          },
          "status": "pass",
          "texture": {
            "asset_id": "tex_f0fdae10f3280d078612",
            "binding_status": "project_bindable",
            "path": "Assets/Hovl Studio/Sword slash VFX/Textures/Flash21.png",
            "tags": [
              "alpha.gradient",
              "alpha.sparse",
              "alpha.structured",
              "luma.bright_core",
              "luma.high_contrast",
              "luma.overbright_risk",
              "quality.license_unknown",
              "resolution.large",
              "role.core_shape",
              "role.edge_accent",
              "role.hit_accent",
              "role.noise_control",
              "semantic.slash",
              "semantic.spark",
              "shape.square",
              "size.1024x1024",
              "slot.alpha_mask",
              "slot.base_map",
              "slot.emission_map"
            ]
          },
          "texture_property_name": "_MainTex"
        },
        {
          "candidate_id": "material_candidate_0a84592fddc579c7",
          "material": {
            "binding_status": "usable",
            "material_id": "material_26fbd5da273f007d1ef2",
            "path": "Assets/VFXSourceIngest/Trains/Trains_FX_All_001/ArtResources/FX/Battle/Fx_starchain/mat/Mat_starchain_trail_03.mat"
          },
          "scores": {
            "color": 0,
            "diversity": 0.232429,
            "family": 24.0,
            "pairing": 32.0,
            "performance": 3.0,
            "pipeline": 4.0,
            "role": 30.0,
            "slot": 16.0,
            "style": 0,
            "total": 109.232429
          },
          "selection_basis": [
            "material, Shader and Texture are jointly ranked",
            "effect_family=explosion",
            "style_family=cartoon",
            "layer_role=core",
            "texture_property=_MainTex",
            "all selected assets are project_bindable",
            "prior Unity Material property binding is preferred when available"
          ],
          "shader": {
            "asset_id": "shader_8f3c853a4f046209e4cf",
            "binding_status": "project_bindable",
            "name": "Common/ColorDefault",
            "path": "Assets/VFXSourceIngest/Shared/ShaderPackages/Bundles/Shaders/Common/ColorDefault.shader",
            "pipeline_tags": [
              "builtin"
            ]
          },
          "status": "pass",
          "texture": {
            "asset_id": "tex_d21132ecbab961e969b5",
            "binding_status": "project_bindable",
            "path": "Assets/VFXSourceIngest/Shared/Textures/d2/Tex_starchain_trail_02_d21132ecbab961e9.png",
            "tags": [
              "alpha.cutout",
              "alpha.gradient",
              "alpha.sparse",
              "alpha.structured",
              "luma.bright_core",
              "luma.high_contrast",
              "luma.overbright_risk",
              "motion.uv_scroll_u",
              "resolution.small",
              "role.core_shape",
              "role.edge_accent",
              "role.hit_accent",
              "role.noise_control",
              "role.residual_trail",
              "semantic.spark",
              "semantic.trail",
              "shape.rectangle",
              "size.128x64",
              "slot.alpha_mask",
              "slot.base_map",
              "slot.emission_map"
            ]
          },
          "texture_property_name": "_MainTex"
        },
        {
          "candidate_id": "material_candidate_603bbc69c44c94cc",
          "material": {
            "binding_status": "usable",
            "material_id": "material_f716a35716535c0c957b",
            "path": "Assets/Hovl Studio/Sword slash VFX/Materials/SmokeAnim1.mat"
          },
          "scores": {
            "color": 0,
            "diversity": 0.812107,
            "family": 24.0,
            "pairing": 32.0,
            "performance": -2.0,
            "pipeline": 4.0,
            "role": 30.0,
            "slot": 16.0,
            "style": 0,
            "total": 104.812107
          },
          "selection_basis": [
            "material, Shader and Texture are jointly ranked",
            "effect_family=explosion",
            "style_family=cartoon",
            "layer_role=core",
            "texture_property=_MainTex",
            "all selected assets are project_bindable",
            "prior Unity Material property binding is preferred when available"
          ],
          "shader": {
            "asset_id": "shader_3aacdc74b5eccdb04b80",
            "binding_status": "project_bindable",
            "name": "ERB/Particles/Blend_CenterGlow",
            "path": "Assets/Hovl Studio/Sword slash VFX/Shaders/Blend_CenterGlow.shader",
            "pipeline_tags": [
              "builtin"
            ]
          },
          "status": "pass",
          "texture": {
            "asset_id": "tex_1b61b818f2ddeb9ca051",
            "binding_status": "project_bindable",
            "path": "Assets/Hovl Studio/Sword slash VFX/Textures/SmokeAnim1.png",
            "tags": [
              "alpha.cutout",
              "alpha.gradient",
              "alpha.sparse",
              "alpha.structured",
              "luma.bright_core",
              "luma.dark_background",
              "luma.high_contrast",
              "luma.overbright_risk",
              "quality.license_unknown",
              "resolution.large",
              "role.core_shape",
              "role.noise_control",
              "semantic.slash",
              "semantic.smoke",
              "shape.square",
              "size.2048x2048",
              "slot.alpha_mask",
              "slot.base_map"
            ]
          },
          "texture_property_name": "_MainTex"
        }
      ],
      "component_id": "p0000",
      "layer_role": "core",